priority,action_id,evidence_gap,current_status,current_evidence,recommended_action,minimum_success_criterion,stop_or_continue_rule,command,manuscript_upgrade,claim_boundary,complete
1,E01_openfoam_first_pressure_case,pressure-response calibration for hydraulic consequence,complete_pressure_evidence,"valid_pressure_cases=3, strict_pressure_cases=3, engineering_screening_cases=3, uncoupled_hydraulic_field_cases=0, solver_hydraulic_field_coupled_cases=3, pressure_drop_unique_values=3, unique_flow_geometries=3, geometry_distinguishable=True, manuscript_ready=True",Pressure evidence is complete for the current handoff; keep wording bounded and do not rerun unless the geometry changes.,Complete strict pressure evidence already available for the current handoff.,Use returned pressure only within the cropped-domain numerical-evidence boundary.,python3 papers/paper2_voxel_topology_clogging/scripts/make_openfoam_manuscript_snippet.py,Can move pressure discussion from proxy-only to pressure-informed if result passes the evidence gate.,No OpenFOAM pressure claim until returned archive is imported and evidence gate passes.,
2,E02_complete_906_localized_release,longer internal-source retention/migration window,main_or_supplementary_evidence,"final_time_s=0.04, target_s=0.04",No further 906 run is needed for the present manuscript; use the target-time 40 ms row and keep source-position claims bounded.,"Reach target time and refresh localized production summary with retention, downstream fraction and outlet fraction.",Completed for the present manuscript; rerun only for repeat seeds or longer windows.,ONLY=906_upstream_source_continue_1M_to_4M NP=${NP:-16} LIGGGHTS_BIN=${LIGGGHTS_BIN:-lmp_mpi_no_vtk} bash papers/paper2_voxel_topology_clogging/scripts/run_explicit_localized_production_queue.sh,Improves source-zone retention evidence and reduces reliance on partial production windows.,Still not a complete source-location scaling law unless additional source positions/seeds are completed.,True
3,E03_repeat_seed_near_threshold,near-threshold stochasticity and seed uncertainty,formal_seed_count=3/3,summary_decision=repeat_seed_evidence_ready; final_BTC_mean=0.016444444444444446; range=0.013333333333333334--0.018333333333333333,No further repeat-seed run is needed for the present CES route; keep the inserted uncertainty wording bounded.,"At least three frozen-bed processed rows with final BTC, first-breakthrough time and retention for the near-threshold state.",Completed for the present manuscript; do not expand repeat evidence unless a new regime map is planned.,"Prepare frozen repeat cases for missing seeds, run LIGGGHTS, then post-process with analyze_debris_transport.py.",Turns the near-threshold statement from single-seed evidence into uncertainty-aware evidence.,Formal repeat-seed uncertainty is available and inserted only as stochastic variability evidence; it is not a critical-transition law.,True
4,E04_908_high_inventory_diagnostic,higher-inventory localized blockage stress test,main_or_supplementary_evidence,"final_time_s=0.01, target_s=0.01",No further 908 run is needed for the present manuscript.,Reach 10 ms without numerical instability and quantify whether Bmax or connectivity loss leaves the O(1e-5) window.,"If no outlet release or connectivity loss appears at 10 ms, retain the sparse-front/pre-clogging interpretation and avoid further inventory escalation without a new mechanism question.",ONLY=908_high_inventory_dt5e9_to_10ms NP=${NP:-16} LIGGGHTS_BIN=${LIGGGHTS_BIN:-lmp_mpi_no_vtk} bash papers/paper2_voxel_topology_clogging/scripts/run_explicit_localized_production_queue.sh,"May support a stronger stress-test boundary, but it is lower priority than pressure evidence and repeat seeds.",Diagnostic-only until target time and stability checks are complete.,True
5,E05_expand_dimensionless_map,full regime-map density,current_rows=9; localized_source_rows=3,"Current dimensionless map is a derived nine-row synthesis covering drive, loading and localized-source mechanism axes.",No further dimensionless-map expansion is needed for the present bounded manuscript; only expand if new formal DEM/flow evidence is generated.,"At least three drive rows, three loading rows and three localized-source rows have explicit source files, evidence boundaries and no mixed frozen/unfrozen interpretation.","Do not expand with diagnostic-only rows unless they are visually separated and excluded from formal conclusions; after the three-axis map is complete, move to manuscript polish or new mechanism-generating simulations.",python3 papers/paper2_voxel_topology_clogging/scripts/make_dimensionless_mechanism_map.py,Converts Fig. S16 from evidence synthesis toward a denser regime map.,"Still not universal unless the scan covers broader df/dp, ug, loading and seed variability.",True
